{
  "$schema": "https://cdn.jsdelivr.net/npm/@thelol3882/lexen/schema/i18n.config.schema.json",
  "srcDir": "src",
  "locales": ["en"],
  "defaultLocale": "en",
  "filePatterns": ["**/*.{ts,tsx}"],
  "ignore": ["**/*.d.ts", "**/node_modules/**"],
  "hook": {
    "name": "useTranslation",
    "package": "react-i18next"
  },
  "layout": {
    "feature": "features/{namespace}/locales/{locale}.json",
    "global": "locales/{locale}/common.json",
    "globalNamespace": "common",
    "featuresDir": "features"
  }
}
